{"$schema":"https://json-schema.org/draft/2020-12/schema","$id":"https://raw.githubusercontent.com/johnarleyburns/free-exercise-db-plusplus/main/workout-intent.schema.json","title":"Free Exercise DB++ Workout Intent","type":"object","additionalProperties":false,"required":["schemaVersion"],"properties":{"schemaVersion":{"const":"0.1.0"},"intentId":{"type":"string"},"subjectId":{"type":"string"},"goal":{"enum":["hypertrophy","strength","muscular_endurance","general_fitness","skill_practice","power"]},"schedule":{"type":"object"},"sessionConstraints":{"type":"object"},"environment":{"enum":["commercial_gym","home_gym","minimal_equipment","bodyweight_only","custom"]},"equipmentOverrides":{"type":"object"},"exerciseConstraints":{"type":"object"},"preferences":{"type":"object"},"continuity":{"enum":["preserve","neutral","vary"]},"useHistory":{"type":"boolean"},"historyWindow":{"type":"string"},"requestedPlanningPolicy":{"type":"string"},"requestedGoalPolicy":{"type":"string"}}}
